Key,Description,Example
QUEUE,Queue to deliver the media type to,mediaproc
QUEUED_MESSAGE,Message to show on queue listing,"\_('Image is being processed')"
QUEUE_USING_VERSION,Version to use when queueing,original
MEDIA_VIEW_DEFAULT_VERSION,"Name of the media version that should be used as the default for display for the specified mimetype.

* This is only a suggestion \- it's the version to display in the absence of any overriding value provided by the user.","tilepic"
MEDIA_PREVIEW_DEFAULT_VERSION,"Default version to display as a preview for the given field based upon the currently loaded row","small"
VERSIONS,"Versions describe different representation versions. See :ref:`providenceConfiguration/mainConfiguration/media_processing.conf:VERSIONS` for further details",\-